{
  "version": "synthetic-v1",
  "now": "2026-08-24T12:00:00.000Z",
  "memories": [
    {"id":"m01","content":"Cloud Memory currently uses hybrid retrieval across D1 and Vectorize.","importance":0.8,"confidence":1,"status":"active","validFrom":"2026-08-01T00:00:00.000Z","validUntil":null,"createdAt":"2026-08-01T00:00:00.000Z","updatedAt":"2026-08-20T00:00:00.000Z"},
    {"id":"m02","content":"The previous Cloud Memory retrieval used only a local lexical index.","importance":0.6,"confidence":0.9,"status":"superseded","validFrom":"2025-01-01T00:00:00.000Z","validUntil":"2026-07-31T23:59:59.000Z","createdAt":"2025-01-01T00:00:00.000Z","updatedAt":"2026-07-31T23:59:59.000Z"},
    {"id":"m03","content":"D1 stores the active Cloud Memory archive and its audit events.","importance":0.8,"confidence":1,"status":"active","validFrom":"2026-01-01T00:00:00.000Z","validUntil":null,"createdAt":"2026-01-01T00:00:00.000Z","updatedAt":"2026-08-18T00:00:00.000Z"},
    {"id":"m04","content":"Vectorize holds BGE embeddings for semantic memory retrieval.","importance":0.7,"confidence":0.95,"status":"active","validFrom":"2026-01-01T00:00:00.000Z","validUntil":null,"createdAt":"2026-01-01T00:00:00.000Z","updatedAt":"2026-08-12T00:00:00.000Z"},
    {"id":"m05","content":"GitHub OAuth protects the Cloud Memory worker dashboard.","importance":0.75,"confidence":1,"status":"active","validFrom":"2026-01-01T00:00:00.000Z","validUntil":null,"createdAt":"2026-01-01T00:00:00.000Z","updatedAt":"2026-08-10T00:00:00.000Z"},
    {"id":"m06","content":"The worker exposes a remote MCP endpoint for memory tools.","importance":0.65,"confidence":0.9,"status":"active","validFrom":"2026-01-01T00:00:00.000Z","validUntil":null,"createdAt":"2026-01-01T00:00:00.000Z","updatedAt":"2026-08-10T00:00:00.000Z"},
    {"id":"m07","content":"Project Atlas uses a release checklist with a canary review.","importance":0.65,"confidence":0.9,"status":"active","validFrom":"2026-02-01T00:00:00.000Z","validUntil":null,"createdAt":"2026-02-01T00:00:00.000Z","updatedAt":"2026-08-05T00:00:00.000Z"},
    {"id":"m08","content":"Project Beacon uses encrypted exports for repository backups.","importance":0.7,"confidence":0.95,"status":"active","validFrom":"2026-02-01T00:00:00.000Z","validUntil":null,"createdAt":"2026-02-01T00:00:00.000Z","updatedAt":"2026-08-05T00:00:00.000Z"},
    {"id":"m09","content":"Project Cinder uses an Obsidian projection for local notes.","importance":0.72,"confidence":0.95,"status":"active","validFrom":"2026-02-01T00:00:00.000Z","validUntil":null,"createdAt":"2026-02-01T00:00:00.000Z","updatedAt":"2026-08-05T00:00:00.000Z"},
    {"id":"m10","content":"Project Delta uses task snapshots to track outstanding work.","importance":0.72,"confidence":0.95,"status":"active","validFrom":"2026-02-01T00:00:00.000Z","validUntil":null,"createdAt":"2026-02-01T00:00:00.000Z","updatedAt":"2026-08-05T00:00:00.000Z"},
    {"id":"m11","content":"The Obsidian projection is the preferred note handoff for active projects.","importance":0.9,"confidence":0.98,"status":"active","validFrom":"2026-02-01T00:00:00.000Z","validUntil":null,"createdAt":"2026-02-01T00:00:00.000Z","updatedAt":"2026-08-19T00:00:00.000Z"},
    {"id":"m12","content":"The high-importance export decision requires encrypted repository backups.","importance":1,"confidence":1,"status":"active","validFrom":"2026-01-01T00:00:00.000Z","validUntil":null,"createdAt":"2026-01-01T00:00:00.000Z","updatedAt":"2026-08-19T00:00:00.000Z"},
    {"id":"m13","content":"The old Cloud Memory import used daily full snapshots without idempotency.","importance":0.55,"confidence":0.85,"status":"superseded","validFrom":"2025-01-01T00:00:00.000Z","validUntil":"2026-07-15T00:00:00.000Z","createdAt":"2025-01-01T00:00:00.000Z","updatedAt":"2026-07-15T00:00:00.000Z"},
    {"id":"m14","content":"The current Cloud Memory import uses idempotent batches and bounded capture.","importance":0.85,"confidence":1,"status":"active","validFrom":"2026-07-16T00:00:00.000Z","validUntil":null,"createdAt":"2026-07-16T00:00:00.000Z","updatedAt":"2026-08-21T00:00:00.000Z"},
    {"id":"m15","content":"The historical ranking policy used unbounded recency as a universal relevance proxy.","importance":0.5,"confidence":0.8,"status":"superseded","validFrom":"2025-01-01T00:00:00.000Z","validUntil":"2026-07-01T00:00:00.000Z","createdAt":"2025-01-01T00:00:00.000Z","updatedAt":"2026-07-01T00:00:00.000Z"},
    {"id":"m16","content":"The current ranking policy applies bounded temporal, entity, and importance signals.","importance":0.95,"confidence":1,"status":"active","validFrom":"2026-07-02T00:00:00.000Z","validUntil":null,"createdAt":"2026-07-02T00:00:00.000Z","updatedAt":"2026-08-22T00:00:00.000Z"},
    {"id":"m17","content":"The latest automation hook captures up to three durable candidates at task finish.","importance":0.88,"confidence":0.98,"status":"active","validFrom":"2026-08-01T00:00:00.000Z","validUntil":null,"createdAt":"2026-08-01T00:00:00.000Z","updatedAt":"2026-08-22T00:00:00.000Z"},
    {"id":"m18","content":"The previous export format stored unencrypted snapshots in a temporary archive.","importance":0.4,"confidence":0.8,"status":"superseded","validFrom":"2025-01-01T00:00:00.000Z","validUntil":"2026-06-01T00:00:00.000Z","createdAt":"2025-01-01T00:00:00.000Z","updatedAt":"2026-06-01T00:00:00.000Z"},
    {"id":"m19","content":"Semantic deduplication checks exact hashes before a bounded vector similarity candidate check.","importance":0.9,"confidence":1,"status":"active","validFrom":"2026-08-01T00:00:00.000Z","validUntil":null,"createdAt":"2026-08-01T00:00:00.000Z","updatedAt":"2026-08-22T00:00:00.000Z"},
    {"id":"m20","content":"Supersession tracking preserves the old record and appends an explicit audit event.","importance":0.9,"confidence":1,"status":"active","validFrom":"2026-08-01T00:00:00.000Z","validUntil":null,"createdAt":"2026-08-01T00:00:00.000Z","updatedAt":"2026-08-22T00:00:00.000Z"}
  ],
  "queries": [
    {"id":"q01","category":"exact","query":"Cloud Memory hybrid retrieval","relevant":["m01"],"graded":{"m01":3},"candidates":[{"id":"m01","score":0.92},{"id":"m02","score":0.55},{"id":"m03","score":0.48}]},
    {"id":"q02","category":"paraphrase","query":"How are D1 and vectors combined for recall?","relevant":["m01"],"graded":{"m01":3},"candidates":[{"id":"m03","score":0.74},{"id":"m01","score":0.72},{"id":"m04","score":0.69}]},
    {"id":"q03","category":"current","query":"What is the current Cloud Memory retrieval?","relevant":["m01"],"graded":{"m01":3},"candidates":[{"id":"m02","score":0.78},{"id":"m01","score":0.76},{"id":"m03","score":0.6}]},
    {"id":"q04","category":"historical","query":"What was the previous Cloud Memory retrieval?","relevant":["m02"],"graded":{"m02":3},"candidates":[{"id":"m01","score":0.78},{"id":"m02","score":0.76},{"id":"m03","score":0.6}]},
    {"id":"q05","category":"historical","query":"Show the 2025 retrieval decision","relevant":["m02"],"graded":{"m02":3},"candidates":[{"id":"m01","score":0.71},{"id":"m02","score":0.7},{"id":"m15","score":0.4}]},
    {"id":"q06","category":"current","query":"What is the current import workflow?","relevant":["m14"],"graded":{"m14":3},"candidates":[{"id":"m13","score":0.79},{"id":"m14","score":0.77},{"id":"m03","score":0.5}]},
    {"id":"q07","category":"historical","query":"What was the old import workflow?","relevant":["m13"],"graded":{"m13":3},"candidates":[{"id":"m14","score":0.79},{"id":"m13","score":0.77},{"id":"m03","score":0.5}]},
    {"id":"q08","category":"exact","query":"Which model creates Vectorize embeddings?","relevant":["m04"],"graded":{"m04":3},"candidates":[{"id":"m03","score":0.75},{"id":"m04","score":0.73},{"id":"m01","score":0.5}]},
    {"id":"q09","category":"exact","query":"Where is the active archive stored?","relevant":["m03"],"graded":{"m03":3},"candidates":[{"id":"m04","score":0.76},{"id":"m03","score":0.74},{"id":"m06","score":0.5}]},
    {"id":"q10","category":"exact","query":"What protects the dashboard?","relevant":["m05"],"graded":{"m05":3},"candidates":[{"id":"m06","score":0.74},{"id":"m05","score":0.72},{"id":"m03","score":0.5}]},
    {"id":"q11","category":"entity","query":"Which checklist belongs to Project Atlas?","relevant":["m07"],"graded":{"m07":3},"candidates":[{"id":"m08","score":0.78},{"id":"m07","score":0.77},{"id":"m09","score":0.5}]},
    {"id":"q12","category":"entity","query":"Which project uses encrypted exports: Project Beacon?","relevant":["m08"],"graded":{"m08":3},"candidates":[{"id":"m07","score":0.78},{"id":"m08","score":0.77},{"id":"m12","score":0.56}]},
    {"id":"q13","category":"entity","query":"What does Project Cinder use for notes?","relevant":["m09"],"graded":{"m09":3},"candidates":[{"id":"m10","score":0.78},{"id":"m09","score":0.77},{"id":"m11","score":0.6}]},
    {"id":"q14","category":"entity","query":"Which project tracks outstanding work: Project Delta?","relevant":["m10"],"graded":{"m10":3},"candidates":[{"id":"m09","score":0.78},{"id":"m10","score":0.77},{"id":"m07","score":0.5}]},
    {"id":"q15","category":"importance","query":"What is the important export decision?","relevant":["m12"],"graded":{"m12":3},"candidates":[{"id":"m08","score":0.79},{"id":"m12","score":0.78},{"id":"m03","score":0.55}]},
    {"id":"q16","category":"importance","query":"Which note handoff is preferred?","relevant":["m11"],"graded":{"m11":3},"candidates":[{"id":"m09","score":0.79},{"id":"m11","score":0.77},{"id":"m06","score":0.5}]},
    {"id":"q17","category":"historical","query":"What did the historical ranking policy do?","relevant":["m15"],"graded":{"m15":3},"candidates":[{"id":"m16","score":0.8},{"id":"m15","score":0.78},{"id":"m01","score":0.5}]},
    {"id":"q18","category":"current","query":"What does the current ranking policy apply?","relevant":["m16"],"graded":{"m16":3},"candidates":[{"id":"m15","score":0.8},{"id":"m16","score":0.78},{"id":"m01","score":0.5}]},